{
  "document_metadata": {
    "document_id": "REG-AML-2026-CTD-M3",
    "drug_substance": "Amlodipine Besylate (USP/Ph. Eur.)",
    "dmf_number": "US DMF 028491 / CEP 2021-104",
    "submitting_entity": "Pharmaceutics Global R&D; & Regulatory Operations",
    "target_authorities": [
      "US FDA (CDER)",
      "EMA",
      "PMDA"
    ],
    "submission_purpose": "Post-Approval Synthetic Route Change (Step 1)",
    "ctd_module_scope": "3.2.S.1 through 3.2.S.7 Complete Package",
    "effective_date": "September 2026",
    "qa_protocol_id": "QA-AML-2026-COMP-01",
    "manufacturing_site": "Unit-B, Block 3 (Rx-04)",
    "plant_location": "Site 4, Unit-B (Commercial Manufacturing Facility)",
    "target_markets": [
      "US FDA (PAS)",
      "EU (Type II)"
    ]
  },
  "drug_substance_profile": {
    "iupac_name": "3-ethyl 5-methyl (4RS)-4-(2-chlorophenyl)-2-{[2-(aminoethoxy)methyl]-6-methyl-1,4-dihyd ropyridine-3,5-dicarboxylate benzenesulfonate}",
    "cas_number_besylate": "111470-99-6",
    "cas_number_free_base": "88150-42-9",
    "molecular_formula": "C20H25ClN2O5 \u00b7 C6H6O3S | 567.05 g/mol",
    "molecular_weight": "567.05 g/mol",
    "stereochemistry": "Chiral Center at C4; Marketed as Racemate (1:1 R/S mixture)",
    "melting_point_range_c": "198.5\u00b0C to 201.0\u00b0C (Endothermic Peak Decomposition)",
    "pka": "8.6 at 25\u00b0C (Amine Functionality)",
    "log_p": "Log P = 3.0 (Octanol / Water System)",
    "solubility_matrix": [
      {
        "media": "0.1 N Hydrochloric Acid (HCl)",
        "ph": "1.2",
        "solubility": "25.4 mg/mL",
        "classification": "Freely Soluble"
      },
      {
        "media": "Acetate Buffer",
        "ph": "4.5",
        "solubility": "11.2 mg/mL",
        "classification": "Soluble"
      },
      {
        "media": "Phosphate Buffer (PBS)",
        "ph": "6.8",
        "solubility": "1.85 mg/mL",
        "classification": "Slightly Soluble"
      },
      {
        "media": "Purified Water",
        "ph": "6.5",
        "solubility": "0.78 mg/mL",
        "classification": "Very Slightly Soluble"
      },
      {
        "media": "Methanol",
        "ph": "N/A",
        "solubility": "78.0 mg/mL",
        "classification": "Freely Soluble"
      },
      {
        "media": "Isopropanol (IPA)",
        "ph": "N/A",
        "solubility": "14.5 mg/mL",
        "classification": "Sparingly Soluble"
      },
      {
        "media": "Acetone",
        "ph": "N/A",
        "solubility": "8.2 mg/mL",
        "classification": "Slightly Soluble"
      }
    ]
  },
  "ksm_and_raw_materials": [
    {
      "material_name": "Ethyl 4-(2-(1,3-dioxoisoindolin-2-yl)et hoxy)-3-oxobutanoate",
      "cas_number": "88150-62-3",
      "role": "Key Starting Material (KSM - Step 1)",
      "acceptance_specification": "Purity >= 98.5% (HPLC) Single Impurity <= 0.3% Water Content <= 0.2%",
      "purge_rationale": "Defines core scaffold; unreacted phthalimide reagents are purged during Step 2 aqueous extractions."
    },
    {
      "material_name": "2-Chlorobenzaldehyde",
      "cas_number": "89-98-5",
      "role": "Raw Material (Step 1)",
      "acceptance_specification": "Assay >= 99.0% (GC) 2-Chlorobenzoic acid <= 0.5%",
      "purge_rationale": "Excess aldehyde is purged in isolation slurry; acid form forms soluble salts removed in filtration."
    },
    {
      "material_name": "Methyl 3-aminocrotonate",
      "cas_number": "14205-39-1",
      "role": "Raw Material (Step 1)",
      "acceptance_specification": "Assay >= 98.0% (GC) Moisture <= 0.3%",
      "purge_rationale": "Self-condensates are water soluble and purged in Step 2 washings."
    },
    {
      "material_name": "Aqueous Methylamine",
      "cas_number": "74-89-5",
      "role": "Reagent (Step 2)",
      "acceptance_specification": "Concentration: 39.0 - 41.0% w/w",
      "purge_rationale": "Drives phthalimide cleavage; excess amine is volatile and purged in vacuum drying."
    },
    {
      "material_name": "Benzenesulfonic Acid",
      "cas_number": "98-11-3",
      "role": "Reagent (Step 3)",
      "acceptance_specification": "Assay >= 98.0% Free H2SO4 <= 0.3%",
      "purge_rationale": "Forms target salt; controlled stoichiometry prevents free base carryover."
    },
    {
      "material_name": "Isopropanol (IPA)",
      "cas_number": "67-63-0",
      "role": "Process Solvent (Class 3)",
      "acceptance_specification": "Purity >= 99.8% Non-volatile matter <= 0.001%",
      "purge_rationale": "Primary reaction/crystallization media; regulated per ICH Q3C."
    }
  ],
  "process_controls": {
    "critical_process_parameters": [
      {
        "process_step": "Step 1: Condensation",
        "parameter": "Reaction Temp (CPP)",
        "target": "81.0\u00b0C",
        "proven_acceptable_range": "78.0\u00b0C - 84.0\u00b0C",
        "cqa_impact": "Temperature > 85\u00b0C increases oxidative pyridine impurity A."
      },
      {
        "process_step": "Step 1: Condensation",
        "parameter": "Agitation Speed (Non-CPP)",
        "target": "85 rpm",
        "proven_acceptable_range": "70 - 100 rpm",
        "cqa_impact": "Ensures thermal mass uniformity; minimal effect on profile."
      },
      {
        "process_step": "Step 2: Deprotection",
        "parameter": "Methylamine Addition Rate (CPP)",
        "target": "2.0 L/min",
        "proven_acceptable_range": "1.5 - 2.5 L/min",
        "cqa_impact": "Exotherm control; prevents degradation of dimer impurity."
      },
      {
        "process_step": "Step 2: Deprotection",
        "parameter": "Reaction Time (CPP)",
        "target": "6.0 Hours",
        "proven_acceptable_range": "5.0 - 8.0 Hours",
        "cqa_impact": "Time < 5 hrs leaves incomplete deprotection (>0.2% Int I)."
      },
      {
        "process_step": "Step 3: Salt Formation",
        "parameter": "Acid Addition Duration (CPP)",
        "target": "90 Minutes",
        "proven_acceptable_range": "75 - 120 Minutes",
        "cqa_impact": "Rapid addition causes amorphous salt precipitation."
      },
      {
        "process_step": "Step 3: Crystallization",
        "parameter": "Cooling Rate (CPP)",
        "target": "0.5\u00b0C / min",
        "proven_acceptable_range": "0.3\u00b0C - 0.7\u00b0C / min",
        "cqa_impact": "Controls particle size distribution (D90) and polymorphic Form I."
      },
      {
        "process_step": "Step 3: Vacuum Drying",
        "parameter": "Drying Temp / Pressure (CPP)",
        "target": "45\u00b0C / >=650 mmHg",
        "proven_acceptable_range": "40\u00b0C - 50\u00b0C",
        "cqa_impact": "Excess heat causes degradation; controls residual IPA < 3000 ppm."
      }
    ],
    "hold_time_limits": [
      {
        "intermediate_stage": "Step 1 Wet Cake (Int I)",
        "storage_condition": "Ambient (20-25\u00b0C), Sealed Drum",
        "max_hold_time": "7 Days",
        "retest_parameter": "Related Substances & Purity (HPLC)"
      },
      {
        "intermediate_stage": "Step 2 Free Base Solution",
        "storage_condition": "Stainless Tank at 15-20\u00b0C",
        "max_hold_time": "48 Hours",
        "retest_parameter": "Assay & Color Variation Index"
      },
      {
        "intermediate_stage": "Step 3 Crude Wet Besylate",
        "storage_condition": "Chilled Stainless Vessel (5-10\u00b0C)",
        "max_hold_time": "72 Hours",
        "retest_parameter": "Polymorphic Form Integrity (PXRD)"
      },
      {
        "intermediate_stage": "Final Micronized API",
        "storage_condition": "Double PE Bag in HDPE Drum",
        "max_hold_time": "36 Months",
        "retest_parameter": "Full Release Specification Retest"
      }
    ]
  },
  "impurity_profile": {
    "organic_impurities": [
      {
        "impurity_name": "Impurity A: Oxidative Pyridine analogue",
        "cas_number": "113994-41-5",
        "origin": "Process / Degradant (Oxidation)",
        "ich_q3a_limit": "0.15%",
        "proposed_spec": "NMT 0.10%",
        "batch_range_observed": "< 0.02% - 0.04%"
      },
      {
        "impurity_name": "Impurity B: Methyl ester analogue",
        "cas_number": "103863-88-9",
        "origin": "Raw Material Transesterification",
        "ich_q3a_limit": "0.15%",
        "proposed_spec": "NMT 0.10%",
        "batch_range_observed": "< 0.01% - 0.03%"
      },
      {
        "impurity_name": "Impurity D: Phthalimide intermediate",
        "cas_number": "88150-62-3",
        "origin": "Step 2 Incomplete Reaction",
        "ich_q3a_limit": "0.15%",
        "proposed_spec": "NMT 0.10%",
        "batch_range_observed": "ND (< 0.01%)"
      },
      {
        "impurity_name": "Impurity F: Methyl ethyl ester analogue",
        "cas_number": "140171-66-0",
        "origin": "Side Condensation Step 1",
        "ich_q3a_limit": "0.15%",
        "proposed_spec": "NMT 0.15%",
        "batch_range_observed": "0.03% - 0.06%"
      },
      {
        "impurity_name": "Any Unspecified Impurity",
        "cas_number": null,
        "origin": "Unknown / Synthetic",
        "ich_q3a_limit": "0.10%",
        "proposed_spec": "NMT 0.05%",
        "batch_range_observed": "< 0.03%"
      },
      {
        "impurity_name": "Total Impurities",
        "cas_number": null,
        "origin": "Cumulative Profile",
        "ich_q3a_limit": "N/A",
        "proposed_spec": "NMT 0.50%",
        "batch_range_observed": "0.08% - 0.14%"
      }
    ],
    "residual_solvents": [
      {
        "solvent_name": "Isopropanol (IPA)",
        "ich_class": "Class 3",
        "ich_q3c_limit": "5000 ppm",
        "proposed_qc_spec": "NMT 3000 ppm",
        "observed_level": "450 - 820 ppm"
      },
      {
        "solvent_name": "Methyl Isobutyl Ketone (MIBK)",
        "ich_class": "Class 2",
        "ich_q3c_limit": "450 ppm",
        "proposed_qc_spec": "NMT 250 ppm",
        "observed_level": "12 - 35 ppm"
      },
      {
        "solvent_name": "Methanol",
        "ich_class": "Class 2",
        "ich_q3c_limit": "3000 ppm",